<?xml version="1.0" encoding="UTF-8"?>
<agenda xmlns:xsi="http://www.w3.org/2001/XMLSchema-instance"
    xsi:noNamespaceSchemaLocation="agenda.xsd">
    <evento dia="01" mes="12" ano="2023">
        <titulo>Lorem Ipsum</titulo>
        <hora>08:00</hora>
        <local></local>
        <descricao>
            Lorem ipsum dolor sit amet consectetur,
            adipisicing elit. Magni voluptate dolore
            porro, ut molestias maiores, commodi aspernatur
            expedita magnam odit, dignissimos tempora neque
            nihil soluta quod accusantium aliquam assumenda
            optio?
        </descricao>
    </evento>
    <evento dia="02" mes="12" ano="2023">
        <titulo>Lorem Ipsum</titulo>
        <hora>08:00</hora>
        <local></local>
        <descricao>
            Lorem ipsum dolor sit amet consectetur,
            adipisicing elit. Magni voluptate dolore
            porro, ut molestias maiores, commodi aspernatur
            expedita magnam odit, dignissimos tempora neque
            nihil soluta quod accusantium aliquam assumenda
            optio?
        </descricao>
    </evento>
    <evento dia="03" mes="12" ano="2023">
        <titulo>Lorem Ipsum</titulo>
        <hora>08:00</hora>
        <local></local>
        <descricao>
            Lorem ipsum dolor sit amet consectetur,
            adipisicing elit. Magni voluptate dolore
            porro, ut molestias maiores, commodi aspernatur
            expedita magnam odit, dignissimos tempora neque
            nihil soluta quod accusantium aliquam assumenda
            optio?
        </descricao>
    </evento>
    <evento dia="04" mes="12" ano="2023">
        <titulo>Lorem Ipsum</titulo>
        <hora>08:00</hora>
        <local></local>
        <descricao>
            Lorem ipsum dolor sit amet consectetur,
            adipisicing elit. Magni voluptate dolore
            porro, ut molestias maiores, commodi aspernatur
            expedita magnam odit, dignissimos tempora neque
            nihil soluta quod accusantium aliquam assumenda
            optio?
        </descricao>
    </evento>
</agenda>